file_path,title,topic_0,topic_1,topic_2,topic_3,topic_4
"Data_Abstract/Springer Database/Optimization Letters/62February 2017, Issue 2/paper15.txt",A robust optimization approach for multicast network coding under uncertain link costs,0.131395562269982,0.0,0.0,0.0,0.0
"Data_Abstract/Springer Database/Optimization Letters/62February 2017, Issue 2/paper2.txt",Small subgraphs in preferential attachment networks,0.04094517170782999,0.009816969685952522,0.042005632663254924,0.0034931631466278744,0.0
"Data_Abstract/Springer Database/Optimization Letters/62February 2017, Issue 2/paper3.txt",Improving solution of discrete competitive facility location problems,0.10014732903625041,0.0,0.04575135288095763,0.0,0.006527037885207749
"Data_Abstract/Springer Database/Optimization Letters/62February 2017, Issue 2/paper4.txt",Online makespan minimization in MapReduce-like systems with complex reduce tasks,0.01073469007521136,0.0,0.006391963489133025,0.009931679184616002,0.04492448690619846
"Data_Abstract/Springer Database/Optimization Letters/62February 2017, Issue 2/paper5.txt",General results on preferential attachment and clustering coefficient,0.06363148969410494,0.007367176064856071,0.014196475232484072,0.020848543904492787,0.0
"Data_Abstract/Springer Database/Optimization Letters/62February 2017, Issue 2/paper6.txt",A generalized eigenvalues classifier with embedded feature selection,0.050292500066085266,0.0,0.08231710760837929,0.0,0.006947214742685698
"Data_Abstract/Springer Database/Optimization Letters/62February 2017, Issue 2/paper7.txt",A basic variable neighborhood search heuristic for the uncapacitated multiple allocation p-hub center problem,0.10856066259627101,0.0,0.014917343449901317,0.0,0.0
"Data_Abstract/Springer Database/Optimization Letters/62February 2017, Issue 2/paper8.txt",Clustering and maximum likelihood search for efficient statistical classification with medium-sized databases,0.049781420453182665,0.0,0.06479923107662315,0.015966511018882766,0.0
"Data_Abstract/Springer Database/Optimization Letters/62February 2017, Issue 2/paper9.txt",A parallel maximum clique algorithm for large and massive sparse graphs,0.059978510822958575,0.0,0.05609237632835033,0.0,0.0
"Data_Abstract/Springer Database/Optimization Letters/63March 2017, Issue 3/paper1.txt",On the \({\mathcal {H}}\)-free extension complexity of the TSP,0.016703489359353507,0.0,0.0,0.09030029769588054,0.005286562741665698
"Data_Abstract/Springer Database/Optimization Letters/63March 2017, Issue 3/paper10.txt",An inexact alternating direction method of multipliers with relative error criteria,0.02237006486810537,0.043988345589559816,0.1322614597246713,0.022603757287588924,0.0019864389883604986
"Data_Abstract/Springer Database/Optimization Letters/63March 2017, Issue 3/paper11.txt",On the convergence rate of grid search for polynomial optimization over the simplex,0.016943161905677604,0.0736041628936324,0.02273516008927251,0.011739038148804738,0.015367238481785766
"Data_Abstract/Springer Database/Optimization Letters/63March 2017, Issue 3/paper12.txt",Adaptive inexact fast augmented Lagrangian methods for constrained convex optimization,0.05493288216049081,0.04520232036211304,0.0547858935977305,0.005294274802498753,0.023527879357332325
"Data_Abstract/Springer Database/Optimization Letters/63March 2017, Issue 3/paper13.txt",A DC optimization-based clustering technique for edge detection,0.03579357581090148,0.017472628914189724,0.06444717058840974,0.012173179565698888,0.0
"Data_Abstract/Springer Database/Optimization Letters/63March 2017, Issue 3/paper14.txt",On an \(l_1\) exact penalty result for mathematical programs with vanishing constraints,0.017886617673065437,0.09902354348809547,0.03452716800977939,0.011811690691168551,0.011893259980150001
"Data_Abstract/Springer Database/Optimization Letters/63March 2017, Issue 3/paper2.txt",A two-stage algorithm for combinatorial testing,0.061685947252092005,0.0,0.0351621461761655,0.0,0.0
"Data_Abstract/Springer Database/Optimization Letters/63March 2017, Issue 3/paper3.txt",The sparsest solutions to Z-tensor complementarity problems,0.03736971271752396,0.13700001455225955,0.01184214952488947,0.006490185052871192,0.005413150146216695
"Data_Abstract/Springer Database/Optimization Letters/63March 2017, Issue 3/paper4.txt",Degeneracy removal in cutting plane methods for disjoint bilinear programming,0.04583215397340663,0.0,0.06170634454744137,0.0,0.0
"Data_Abstract/Springer Database/Optimization Letters/63March 2017, Issue 3/paper5.txt",Optimization of power production and costs in microgrids,0.08830766082407795,0.010521746859994593,0.0,0.0,0.005444829722421536
"Data_Abstract/Springer Database/Optimization Letters/63March 2017, Issue 3/paper6.txt",Nonlinear scalarization functions and polar cone in set optimization,0.004283118188113795,0.15035259381571356,0.0,0.06645231033794752,0.0
"Data_Abstract/Springer Database/Optimization Letters/63March 2017, Issue 3/paper7.txt",Extragradient algorithms for equilibrium problems and symmetric generalized hybrid mappings,0.0024331579289920634,0.0,0.10554372673626174,0.14197404491130824,0.0
"Data_Abstract/Springer Database/Optimization Letters/63March 2017, Issue 3/paper8.txt",An improved adaptive trust-region algorithm,0.01270888057053495,0.0,0.19043809533789516,0.012758511386826708,0.0
"Data_Abstract/Springer Database/Optimization Letters/63March 2017, Issue 3/paper9.txt",Parallel Nesterov’s method for large-scale minimization of partially separable functions,0.0,0.031177758920171113,0.1928979682834539,0.0,0.006740723136654574
"Data_Abstract/Springer Database/Optimization Letters/64April 2017, Issue 4/paper1.txt",New performance guarantees for the greedy maximization of submodular set functions,0.05043723980063288,0.036106923499392,0.00035163428111056004,0.030785069262875525,0.0
"Data_Abstract/Springer Database/Optimization Letters/64April 2017, Issue 4/paper10.txt",An alternative MILP model for makespan minimization on assembly lines,0.04212950710469605,0.013676035765743949,0.015438344667242027,0.004367803857591874,0.09311624745799923
"Data_Abstract/Springer Database/Optimization Letters/64April 2017, Issue 4/paper11.txt",Convergence of iterative hard-thresholding algorithm with continuation,0.0,0.0,0.13844321700389672,0.041244848554736646,0.016657857575373608
"Data_Abstract/Springer Database/Optimization Letters/64April 2017, Issue 4/paper12.txt",The restricted strong convexity revisited: analysis of equivalence to error bound and quadratic growth,0.0,0.11581688322418773,0.08208904643072454,0.041297753663586206,0.0
"Data_Abstract/Springer Database/Optimization Letters/64April 2017, Issue 4/paper13.txt",Novel preconditioners based on quasi–Newton updates for nonlinear conjugate gradient methods,0.01297992377800241,0.0,0.15824445624147815,0.00672775396466398,0.0
"Data_Abstract/Springer Database/Optimization Letters/64April 2017, Issue 4/paper14.txt",Alternative equilibria in two-period ultimatum bargaining with envy,0.02400177160412828,0.013928697494055306,0.01012351468669844,0.039561827349005096,0.0
"Data_Abstract/Springer Database/Optimization Letters/64April 2017, Issue 4/paper15.txt",Solving the consumer’s utility-maximization problem with CES and Cobb-Douglas utility function via mathematical inequalities,0.015047698674480874,0.03804106848034602,0.07903616850278429,0.01784867455192854,0.016091532042824007
"Data_Abstract/Springer Database/Optimization Letters/64April 2017, Issue 4/paper16.txt",Scheduling with job-rejection and position-dependent processing times on proportionate flowshops,0.025664869667287243,0.001393912167770688,0.0,0.027196675989191562,0.23630910817640718
"Data_Abstract/Springer Database/Optimization Letters/64April 2017, Issue 4/paper2.txt",Rank aggregation in cyclic sequences,0.08618337908404212,0.00878735877789235,0.0,0.036497785500241145,0.0038716465600364246
"Data_Abstract/Springer Database/Optimization Letters/64April 2017, Issue 4/paper3.txt",The vehicle routing problem with drones: several worst-case results,0.04989945731921385,0.0010418278600237718,0.0,0.01146869172912709,0.07736171216725139
"Data_Abstract/Springer Database/Optimization Letters/64April 2017, Issue 4/paper4.txt",Global optimization test problems based on random field composition,0.03587175141970897,0.05534564843290015,0.12314051918836608,0.0,0.004407297759975193
"Data_Abstract/Springer Database/Optimization Letters/64April 2017, Issue 4/paper5.txt",Better permutations for the single-processor scheduling with time restrictions,0.01726317491532586,0.0,0.0,0.017981310032738392,0.1623007436869738
"Data_Abstract/Springer Database/Optimization Letters/64April 2017, Issue 4/paper6.txt",A new constraint programming approach for optimising a coal rail system,0.11099897213712219,0.028315572669036084,0.0,0.002979291974270782,0.0017094569454195968
"Data_Abstract/Springer Database/Optimization Letters/64April 2017, Issue 4/paper7.txt",Adjoint-based sensitivity analysis by panel methods and CAS,0.03745810322281389,0.01685810284322834,0.0767760738875746,0.0,0.0
"Data_Abstract/Springer Database/Optimization Letters/64April 2017, Issue 4/paper8.txt",A computational approach to determine damage in infrastructure networks from outage reports,0.06863015155961776,0.0,0.0,0.007234913921757238,0.0
"Data_Abstract/Springer Database/Optimization Letters/64April 2017, Issue 4/paper9.txt",Statistical modeling of Vickrey auctions and applications to automated bidding strategies,0.0756236831285765,0.0,0.011484173713580965,0.0,0.0
"Data_Abstract/Springer Database/Optimization Letters/65June 2017, Issue 5/paper2.txt",ARGONAUT: AlgoRithms for Global Optimization of coNstrAined grey-box compUTational problems,0.03786511208585576,0.05403923182309941,0.0698546006044336,0.0,0.0
"Data_Abstract/Springer Database/Optimization Letters/65June 2017, Issue 5/paper3.txt","Constraint relaxation, cost-sensitive learning and bagging for imbalanced classification problems with outliers",0.0673515860707968,0.026126254576813734,0.024233583438484394,0.009954465837116332,0.02422720244158765
"Data_Abstract/Springer Database/Optimization Letters/65June 2017, Issue 5/paper4.txt",Locating facilities in a competitive environment,0.06549033690127014,0.011953837365225659,0.0,0.0,0.0
"Data_Abstract/Springer Database/Optimization Letters/65June 2017, Issue 5/paper5.txt",A nonmonotone inexact Newton method for unconstrained optimization,0.009053714593552068,0.0,0.2771713129206127,0.0,0.006418698493623159
"Data_Abstract/Springer Database/Optimization Letters/65June 2017, Issue 5/paper6.txt",Linear transformation based solution methods for non-convex mixed integer quadratic programs,0.01770278345764398,0.05877684069863777,0.05562499922251627,0.00022948743862258477,0.013313159762067478
"Data_Abstract/Springer Database/Optimization Letters/65June 2017, Issue 5/paper7.txt",An approximation algorithm for the nth power metric facility location problem with linear penalties,0.05049471415806019,0.004653685167746848,0.0,0.0,0.007346717822801107
"Data_Abstract/Springer Database/Optimization Letters/65June 2017, Issue 5/paper8.txt",Real options approach to explore the effect of organizational change on IoT development project,0.061905508987255886,0.0,0.001182011169220836,0.0,0.004678292744242403
"Data_Abstract/Springer Database/Optimization Letters/65June 2017, Issue 5/paper9.txt",Stochastic subgradient descent method for large-scale robust chance-constrained support vector machines,0.046787061698965,0.028492105373706757,0.0683351673194423,0.0,0.004029161854152281
"Data_Abstract/Springer Database/Optimization Letters/66August 2017, Issue 6/paper10.txt",A metaheuristic approach to the dominating tree problem,0.1331911898330309,0.0,0.012151479169855471,0.0,0.0
"Data_Abstract/Springer Database/Optimization Letters/66August 2017, Issue 6/paper11.txt",Solving the robust two-stage capacitated facility location problem with uncertain transportation costs,0.10260113198845895,0.0023686820723446515,0.005390881729869537,0.0,0.0028425439646025384
"Data_Abstract/Springer Database/Optimization Letters/66August 2017, Issue 6/paper2.txt","Sufficient efficiency criteria in multiobjective fractional programming with generalized \(\left( \mathcal {F},b,\phi ,\rho ,\theta \right) \)-univex \(n\)-set functions",0.007717121722450228,0.19539888799543897,0.0,0.010965867405262678,0.0
"Data_Abstract/Springer Database/Optimization Letters/66August 2017, Issue 6/paper3.txt",A general variable neighborhood search variants for the travelling salesman problem with draft limits,0.08838275647754801,0.0,0.04658981475924097,0.006820010295073467,0.0
"Data_Abstract/Springer Database/Optimization Letters/66August 2017, Issue 6/paper4.txt",Symmetry properties of resolving sets and metric bases in hypercubes,0.057581853992158274,0.021734518426561208,0.0,0.0080958870073186,0.0
"Data_Abstract/Springer Database/Optimization Letters/66August 2017, Issue 6/paper5.txt",General Variable Neighborhood Search for computing graph separators,0.10380968983438461,0.0,0.02155052345444257,0.0,0.0
"Data_Abstract/Springer Database/Optimization Letters/66August 2017, Issue 6/paper6.txt",New MIP model for multiprocessor scheduling problem with communication delays,0.09374434383773245,0.007992111898050727,0.02433952892329984,0.008512193517337075,0.0
"Data_Abstract/Springer Database/Optimization Letters/66August 2017, Issue 6/paper7.txt",A general variable neighborhood search for solving the uncapacitated \(r\)-allocation \(p\)-hub median problem,0.0868334400510775,0.0,0.02324985550573223,0.0,0.0015109372769702115
"Data_Abstract/Springer Database/Optimization Letters/66August 2017, Issue 6/paper8.txt",Solving the clique partitioning problem as a maximally diverse grouping problem,0.0804893712142668,0.0,0.035068191046413476,0.0,0.0
"Data_Abstract/Springer Database/Optimization Letters/66August 2017, Issue 6/paper9.txt",A metaheuristic approach to solving a multiproduct EOQ-based inventory problem with storage space constraints,0.10754452765574658,0.0,0.03365353838387827,0.0,0.014713864764264329
"Data_Abstract/Springer Database/Optimization Letters/67October 2017, Issue 7/paper1.txt",On the worst-case complexity of the gradient method with exact line search for smooth strongly convex functions,0.0,0.04891425517723557,0.16591952545517297,0.0,0.006602711087401945
"Data_Abstract/Springer Database/Optimization Letters/67October 2017, Issue 7/paper10.txt",Optimization of covered call strategies,0.05437204922237745,0.009405373703430045,0.0,0.00037748940192190765,0.0
"Data_Abstract/Springer Database/Optimization Letters/67October 2017, Issue 7/paper11.txt",The energy-constrained quickest path problem,0.11674006317527773,0.0,0.01680727289346325,0.0,0.023895873179374926
"Data_Abstract/Springer Database/Optimization Letters/67October 2017, Issue 7/paper12.txt",An exact algorithm to extend lifetime through roles allocation in sensor networks with connectivity constraints,0.09402933746923203,0.0,0.01897583676933428,0.0,0.03327678408267708
"Data_Abstract/Springer Database/Optimization Letters/67October 2017, Issue 7/paper13.txt",On a linearization technique for solving the quadratic set covering problem and variations,0.05378141567288522,0.032890545917272425,0.04984486675576428,0.015820678959083644,0.005018699976311466
"Data_Abstract/Springer Database/Optimization Letters/67October 2017, Issue 7/paper14.txt",A biased random-key genetic algorithm for the tree of hubs location problem,0.1416220229111242,0.0,0.004722265534457899,0.0,3.505768960034411e-05
"Data_Abstract/Springer Database/Optimization Letters/67October 2017, Issue 7/paper15.txt",Distributionally robust chance-constrained games: existence and characterization of Nash equilibrium,0.027464580138022904,0.0027438756808825936,0.0,0.09653723640382429,5.363016067697777e-05
"Data_Abstract/Springer Database/Optimization Letters/67October 2017, Issue 7/paper16.txt",Strictly semi-positive tensors and the boundedness of tensor complementarity problems,0.008505073141294684,0.046383452546373376,0.002781460163024515,0.016291211323586262,0.0
"Data_Abstract/Springer Database/Optimization Letters/67October 2017, Issue 7/paper17.txt",Symmetry and antisymmetry properties of optimal solutions to regression problems,0.05679687024272286,0.049605471161960756,0.0012188010110182185,0.01730771419313604,0.045577060626881945
"Data_Abstract/Springer Database/Optimization Letters/67October 2017, Issue 7/paper18.txt",Some properties of the lower bound of optimal values in interval convex quadratic programming,0.024829168171798217,0.16020271313004236,0.0,0.0,0.0
"Data_Abstract/Springer Database/Optimization Letters/67October 2017, Issue 7/paper19.txt",On strong optimality of interval linear programming,0.08857028432542816,0.09588997590086827,0.0,0.0,0.0
"Data_Abstract/Springer Database/Optimization Letters/67October 2017, Issue 7/paper2.txt",Extremality of convex sets with some applications,0.0,0.1530664643815754,0.0,0.049495538204266346,0.0
"Data_Abstract/Springer Database/Optimization Letters/67October 2017, Issue 7/paper20.txt",Sufficient conditions for the unsolvability and solvability of the absolute value equation,0.0,0.07614404142010657,0.01689263672393466,0.015621605622849626,0.031120935078216228
"Data_Abstract/Springer Database/Optimization Letters/67October 2017, Issue 7/paper3.txt",Compositions of convex functions and fully linear models,0.0,0.14865650199904676,0.0720528477326279,0.0,0.01392697297061168
"Data_Abstract/Springer Database/Optimization Letters/67October 2017, Issue 7/paper4.txt",Completely positive reformulations of polynomial optimization problems with linear constraints,0.0399789210293816,0.09984847020813611,0.005228969775083438,0.0,0.0
"Data_Abstract/Springer Database/Optimization Letters/67October 2017, Issue 7/paper5.txt",Empirical mode decomposition-based time grid refinement optimization approach for optimal control problems,0.03453890549488066,0.0,0.15132251527875992,0.000947995879945839,0.037785417846765125
"Data_Abstract/Springer Database/Optimization Letters/67October 2017, Issue 7/paper6.txt","Single-machine serial-batching scheduling with a machine availability constraint, position-dependent processing time, and time-dependent set-up time",0.04028553616265937,0.01622385303465465,0.011646591006159829,0.0,0.20401252435111794
"Data_Abstract/Springer Database/Optimization Letters/67October 2017, Issue 7/paper7.txt",Precedence constrained parallel-machine scheduling of position-dependent jobs,0.0,0.0,0.0,0.0,0.3703142555918305
"Data_Abstract/Springer Database/Optimization Letters/67October 2017, Issue 7/paper8.txt",Speeding up local search for the insert neighborhood in the weighted tardiness permutation flowshop problem,0.036478487476606904,0.008556516563337674,0.040467672947541014,0.0052061705514704305,0.047465724282405475
"Data_Abstract/Springer Database/Optimization Letters/67October 2017, Issue 7/paper9.txt",Calculating approximation guarantees for partial set cover of pairs,0.0804598276284089,0.0,0.001968989683967063,0.019655046024278235,0.008307649851794077
"Data_Abstract/Springer Database/Optimization Letters/68December 2017, Issue 8/paper1.txt",A convex programming-based algorithm for mean payoff stochastic games with perfect information,0.028683778300258485,0.027533983723283025,0.012038479599975933,0.0,0.08584731130802105
"Data_Abstract/Springer Database/Optimization Letters/68December 2017, Issue 8/paper10.txt",A linear-time algorithm for the trust region subproblem based on hidden convexity,0.019507704000281595,0.0,0.10648447105485759,0.0,0.05073615079438639
"Data_Abstract/Springer Database/Optimization Letters/68December 2017, Issue 8/paper11.txt",Finite convergence analysis and weak sharp solutions for variational inequalities,0.0,0.0,0.13028747178896785,0.12606858151936826,0.0007928530718266559
"Data_Abstract/Springer Database/Optimization Letters/68December 2017, Issue 8/paper12.txt",Approximation algorithms for constructing spanning K-trees using stock pieces of bounded length,0.0813916949780961,0.0,0.0,0.0,0.019815442724646925
"Data_Abstract/Springer Database/Optimization Letters/68December 2017, Issue 8/paper13.txt",Convergence of relaxed minimizers in set optimization,0.007637156161659516,0.028216642023993023,0.007478777377864721,0.09118840060422764,0.0016906766147341966
"Data_Abstract/Springer Database/Optimization Letters/68December 2017, Issue 8/paper14.txt",Exact two steps SOCP/SDP formulation for a modified conic trust region subproblem,0.046045032036714,0.026725935182944117,0.0546057519073162,0.006715827668589957,0.0
"Data_Abstract/Springer Database/Optimization Letters/68December 2017, Issue 8/paper15.txt",Characterizations of the solution set for non-essentially quasiconvex programming,0.016176101043988148,0.10884221615131398,0.0,0.029610465193137325,0.0
"Data_Abstract/Springer Database/Optimization Letters/68December 2017, Issue 8/paper16.txt",On metric subregularity for convex constraint systems by primal equivalent conditions,0.0,0.17191003908692898,0.0,0.02492820971984987,0.0
"Data_Abstract/Springer Database/Optimization Letters/68December 2017, Issue 8/paper17.txt",A matrix-free implementation of Riemannian Newton’s method on the Stiefel manifold,0.035002651421984256,0.0018818947068098629,0.18474905231946157,0.0,0.0
"Data_Abstract/Springer Database/Optimization Letters/68December 2017, Issue 8/paper18.txt",Minimax perfect stopping rules for selling an asset near its ultimate maximum,0.028063194861689386,0.018140435689641857,0.0,0.01058846844794914,0.05833728647195083
"Data_Abstract/Springer Database/Optimization Letters/68December 2017, Issue 8/paper19.txt",A note on counting independent terms in asymptotic expressions of computational complexity,0.07442267571291748,0.021684008078267907,0.03746087372207041,0.0011621965486298268,0.0037524902589431805
"Data_Abstract/Springer Database/Optimization Letters/68December 2017, Issue 8/paper2.txt",Matrix monotonicity and self-concordance: how to handle quantum entropy in optimization problems,0.0,0.08550528007959765,0.015693582636453977,0.0,0.009698041575111711
"Data_Abstract/Springer Database/Optimization Letters/68December 2017, Issue 8/paper20.txt",Improved approximation results on standard quartic polynomial optimization,0.055289880087743985,0.076329266239096,0.008369928137965483,0.021211611023331044,0.010561144664515085
"Data_Abstract/Springer Database/Optimization Letters/68December 2017, Issue 8/paper3.txt",Data filtering for cluster analysis by \(\ell _0\)-norm regularization,0.009822702257128016,0.05454132610009169,0.15861485760021607,0.0,0.005014642904570291
"Data_Abstract/Springer Database/Optimization Letters/68December 2017, Issue 8/paper4.txt",A MIP-based slicing heuristic for three-dimensional bin packing,0.08997822393441542,0.0,0.0,0.022656264308694836,0.0
"Data_Abstract/Springer Database/Optimization Letters/68December 2017, Issue 8/paper5.txt",Existence and boundedness of solutions to maximal monotone inclusion problem,0.023817365518531582,0.04510176699041442,0.0,0.09014849558703932,0.0
"Data_Abstract/Springer Database/Optimization Letters/68December 2017, Issue 8/paper6.txt",Optimising for energy or robustness? Trade-offs for VM consolidation in virtualized datacenters under uncertainty,0.07949224066116574,0.0,0.0,0.0003712408460496598,0.019518482711596747
"Data_Abstract/Springer Database/Optimization Letters/68December 2017, Issue 8/paper7.txt",A class of differential fuzzy variational inequalities in finite-dimensional spaces,0.0,0.0,0.040461220390594285,0.1994690729850602,0.0
"Data_Abstract/Springer Database/Optimization Letters/68December 2017, Issue 8/paper8.txt",On quasi \(\epsilon \)-solution for robust convex optimization problems,0.03980070769767614,0.12060895021357135,0.0,0.04712520229286437,0.0
"Data_Abstract/Springer Database/Optimization Letters/68December 2017, Issue 8/paper9.txt",On the minimization of possibly discontinuous functions by means of pointwise approximations,0.03571232582461472,0.02021550100755198,0.051668643898155814,0.023370264625837887,0.0
"Data_Abstract/Springer Database/Optimization Letters/69January 2018, Issue 1/paper10.txt",An operator splitting method for monotone variational inequalities with a new perturbation strategy,0.0,0.0,0.13325632396031498,0.14292786345714067,0.0
"Data_Abstract/Springer Database/Optimization Letters/69January 2018, Issue 1/paper11.txt",Nonlinear separation concerning E-optimal solution of constrained multi-objective optimization problems,0.0,0.22988254203334327,0.0,0.03925172442788756,0.0
"Data_Abstract/Springer Database/Optimization Letters/69January 2018, Issue 1/paper12.txt","Elementary convex techniques for equilibrium, minimax and variational problems",0.01180789242968761,0.0,0.0,0.14843630015678916,0.011125611543931468
"Data_Abstract/Springer Database/Optimization Letters/69January 2018, Issue 1/paper13.txt",A Lagrangian decomposition approach to computing feasible solutions for quadratic binary programs,0.05506499341440411,0.08265680311806772,0.04305784008823761,0.0,0.0
"Data_Abstract/Springer Database/Optimization Letters/69January 2018, Issue 1/paper14.txt",Modeling uncertain passenger arrivals in the elevator dispatching problem with destination control,0.06832031923174788,0.010589885099704219,0.00830340932704657,0.0,0.0
"Data_Abstract/Springer Database/Optimization Letters/69January 2018, Issue 1/paper15.txt",The Hotelling bi-matrix game,0.018900600971312624,0.027551892998342375,0.0,0.07704128194403836,0.0
"Data_Abstract/Springer Database/Optimization Letters/69January 2018, Issue 1/paper16.txt",The geometry of optimal partitions in location problems,0.0661343978567512,0.004868848907553498,0.0,0.0,0.03346435853215518
