file_path,title,topic_0,topic_1,topic_2,topic_3,topic_4
"Data_Abstract/Springer Database/Optimization Letters/41June 2014, Issue 5/paper6.txt",Gap functions and error bounds for generalized vector variational inequalities,0.0,0.005320710541380014,0.0,0.24216947131740632,0.0
"Data_Abstract/Springer Database/Optimization Letters/41June 2014, Issue 5/paper7.txt",On nonsmooth V-invexity and vector variational-like inequalities in terms of the Michel–Penot subdifferentials,0.0,0.03452530539706263,0.0,0.1804563474600375,0.0
"Data_Abstract/Springer Database/Optimization Letters/41June 2014, Issue 5/paper8.txt",Improved online algorithms for the batch scheduling of equal-length jobs with incompatible families to maximize the weighted number of early jobs,0.010233306690981079,0.0,0.004166097849811898,0.012639100367235617,0.17322878702253416
"Data_Abstract/Springer Database/Optimization Letters/41June 2014, Issue 5/paper9.txt",On generalized \(\epsilon \)-subdifferential and radial epiderivative of set-valued mappings,0.0,0.0045197027034937125,0.0,0.12886773773180327,0.0
"Data_Abstract/Springer Database/Optimization Letters/42August 2014, Issue 6/paper10.txt",Subdifferentials of a perturbed minimal time function in normed spaces,0.0,0.08294370845758538,0.002878151679105768,0.03731437317888885,0.057819251554398605
"Data_Abstract/Springer Database/Optimization Letters/42August 2014, Issue 6/paper11.txt",Optimality conditions for vector equilibrium problems with constraint in Banach spaces,0.0,0.12110294076016699,0.0,0.18197189396328015,0.0
"Data_Abstract/Springer Database/Optimization Letters/42August 2014, Issue 6/paper2.txt",A penalty method for a finite-dimensional obstacle problem with derivative constraints,0.010364561755017493,0.06230171031050159,0.13568532787803533,0.02001127167248353,0.00033358012253723284
"Data_Abstract/Springer Database/Optimization Letters/42August 2014, Issue 6/paper3.txt",\(\epsilon \)-Henig proper efficiency of set-valued optimization problems in real ordered linear spaces,0.0,0.07354221382476236,0.01049551179716013,0.11432029142526706,0.0
"Data_Abstract/Springer Database/Optimization Letters/42August 2014, Issue 6/paper4.txt",A primal-dual interior point method for optimal zero-forcing beamformer design under per-antenna power constraints,0.04000071294589512,0.10730140657432945,0.1552134297674793,0.0,0.0
"Data_Abstract/Springer Database/Optimization Letters/42August 2014, Issue 6/paper5.txt",A modified nonmonotone BFGS algorithm for solving smooth nonlinear equations,0.021873717341740002,0.0,0.19175022252755758,0.0,0.0
"Data_Abstract/Springer Database/Optimization Letters/42August 2014, Issue 6/paper6.txt",Optimality conditions for minimizing the difference of nonconvex vector-valued mappings,0.0,0.1626605144470941,0.0,0.041978960354433645,0.0
"Data_Abstract/Springer Database/Optimization Letters/42August 2014, Issue 6/paper7.txt",Stability for differential mixed variational inequalities,0.0016329538772030512,0.0,0.0,0.2252784374826396,0.0
"Data_Abstract/Springer Database/Optimization Letters/42August 2014, Issue 6/paper8.txt",Unified optimization of \(\hbox {H}_{\infty }\) index and upper stability bound for singularly perturbed systems,0.04750307071072651,0.026814150504690607,0.03604223896652735,0.027358208273866303,0.007252424026623695
"Data_Abstract/Springer Database/Optimization Letters/42August 2014, Issue 6/paper9.txt",Stability analysis and optimal control of stochastic singular systems,0.03751449271718441,0.05773890991256375,0.03195127730988811,0.030759826417724737,0.0
"Data_Abstract/Springer Database/Optimization Letters/43October 2014, Issue 7/paper1.txt",A one-step worst-case optimal algorithm for bi-objective univariate optimization,0.04418951152479016,0.04599796466688956,0.07191441613766156,0.0,0.014155990217567443
"Data_Abstract/Springer Database/Optimization Letters/43October 2014, Issue 7/paper10.txt",Similarity automorphism invariance of some P-properties of linear transformations on Euclidean Jordan algebras,0.0048218339020316345,0.05358416180296732,0.00882438229970383,0.0002552601403661002,0.002057472680899982
"Data_Abstract/Springer Database/Optimization Letters/43October 2014, Issue 7/paper11.txt",Solving proximal split feasibility problems without prior knowledge of operator norms,0.025445876846660352,0.06026111173663119,0.038994407518327855,0.03905374802351133,0.0038004541769658317
"Data_Abstract/Springer Database/Optimization Letters/43October 2014, Issue 7/paper12.txt",Discretization orders and efficient computation of cartesian coordinates for distance geometry,0.03305262265613043,0.005419731360253668,0.08982271432705576,0.0325426290401462,0.0
"Data_Abstract/Springer Database/Optimization Letters/43October 2014, Issue 7/paper13.txt",When a vector quasimonotone mapping is a vector monotone mapping,0.0,0.01854824528145686,0.0,0.1642971581175651,0.0
"Data_Abstract/Springer Database/Optimization Letters/43October 2014, Issue 7/paper14.txt",A simple SSD-efficiency test,0.03658719678395315,0.03922115236096476,0.02493019379732122,0.0,0.0
"Data_Abstract/Springer Database/Optimization Letters/43October 2014, Issue 7/paper15.txt",Some preconditioners for systems of linear inequalities,0.032409116277578275,0.009961553813866724,0.004118651307276235,0.04148762141114725,0.0
"Data_Abstract/Springer Database/Optimization Letters/43October 2014, Issue 7/paper2.txt",Market neutral portfolios,0.08231133293579676,0.003725548988369418,0.0,0.0,0.0
"Data_Abstract/Springer Database/Optimization Letters/43October 2014, Issue 7/paper3.txt",On approximation of the best case optimal value in interval linear programming,0.07921100357089499,0.028486565220089,0.027258459184272894,0.008974171476993793,0.009436479562005218
"Data_Abstract/Springer Database/Optimization Letters/43October 2014, Issue 7/paper4.txt",CVaR norm and applications in optimization,0.054597392037804934,0.07660336563270827,0.004031824627522982,0.021669921226652716,0.0
"Data_Abstract/Springer Database/Optimization Letters/43October 2014, Issue 7/paper5.txt",Scalarization of constraints system in some vector optimization problems and applications,0.008918472881150873,0.09308586490631064,0.034320872010704426,0.05442017241081622,0.0006570198475497607
"Data_Abstract/Springer Database/Optimization Letters/43October 2014, Issue 7/paper7.txt",State-constrained optimal control of nonlinear elliptic variational inequalities,0.04217337254961735,0.08102626137000152,0.06450154854019122,0.06634759917716493,0.0
"Data_Abstract/Springer Database/Optimization Letters/43October 2014, Issue 7/paper8.txt",Global solutions of non-Lipschitz \(S_{2}\)–\(S_{p}\) minimization over the positive semidefinite cone,0.015294816675138115,0.08924385823333007,0.02039578898120898,0.014564104477971686,0.02169745801081765
"Data_Abstract/Springer Database/Optimization Letters/43October 2014, Issue 7/paper9.txt",Trade credit competition between two retailers in a supply chain under credit-linked retail price and market demand,0.032633436385517633,0.0,0.009549013484820543,0.0,0.03813173360292252
"Data_Abstract/Springer Database/Optimization Letters/44December 2014, Issue 8/paper10.txt",The coloring problem for classes with two small obstructions,0.05429682450193406,0.03936286113978395,0.0,0.012445995265083635,0.0
"Data_Abstract/Springer Database/Optimization Letters/44December 2014, Issue 8/paper11.txt",A primal-dual method of partial inverses for composite inclusions,0.0068740335006439,0.01322273173939579,0.06697145329803643,0.0327472579452181,0.0
"Data_Abstract/Springer Database/Optimization Letters/44December 2014, Issue 8/paper12.txt",Two modified three-term conjugate gradient methods with sufficient descent property,0.0,0.021937148710816645,0.18463294218229429,0.0,0.0
"Data_Abstract/Springer Database/Optimization Letters/44December 2014, Issue 8/paper13.txt",Farkas-type results for constrained fractional programming with DC functions,0.007332354398344865,0.15684370084123206,0.0,0.018907874356318646,0.0
"Data_Abstract/Springer Database/Optimization Letters/44December 2014, Issue 8/paper14.txt",Continuity of the solution set mappings to a parametric set optimization problem,0.018873172473912455,0.03679594078923491,0.0,0.1436921449925743,0.0
"Data_Abstract/Springer Database/Optimization Letters/44December 2014, Issue 8/paper15.txt",Exact resolution of the two-stage hybrid flow shop with dedicated machines,0.07471976055206293,0.0,0.026058119697830277,0.0,0.02752578538342651
"Data_Abstract/Springer Database/Optimization Letters/44December 2014, Issue 8/paper16.txt",Learning a hidden graph,0.07447193111317657,0.0,0.007512548527865843,0.008590342036553286,0.00857153598640275
"Data_Abstract/Springer Database/Optimization Letters/44December 2014, Issue 8/paper17.txt",A worst-case analysis for the split delivery capacitated team orienteering problem with minimum delivery amounts,0.05516547660055921,0.0,0.0,0.0,0.03800351851608631
"Data_Abstract/Springer Database/Optimization Letters/44December 2014, Issue 8/paper18.txt",A note on the connection between Chaney’s derivatives and epi-derivatives,0.0,0.06581329660667427,0.0022901432146910884,0.00021195139255994125,0.006976091131841745
"Data_Abstract/Springer Database/Optimization Letters/44December 2014, Issue 8/paper2.txt",Acceleration strategies for the weight constrained shortest path problem with replenishment,0.08110657437548827,0.0,0.044975042121202784,0.0,0.02515061393798836
"Data_Abstract/Springer Database/Optimization Letters/44December 2014, Issue 8/paper3.txt",Agreeable solutions of discrete time optimal control problems,0.03398184938823905,0.03435200829394041,0.0,0.05648942741132432,0.00019190953903964737
"Data_Abstract/Springer Database/Optimization Letters/44December 2014, Issue 8/paper4.txt",Directional vs. Shephard’s distance functions,0.018465530811658026,0.07090176586518065,0.018405098131381054,0.0025562126631630015,0.0
"Data_Abstract/Springer Database/Optimization Letters/44December 2014, Issue 8/paper5.txt",The Picard–HSS iteration method for absolute value equations,0.0,0.047938652259155855,0.1423734450866334,0.0,0.011983194543267368
"Data_Abstract/Springer Database/Optimization Letters/44December 2014, Issue 8/paper6.txt",Exact model for the cell formation problem,0.08774758430375378,0.010918695405867243,0.01573089685914506,0.0,0.018553586918853546
"Data_Abstract/Springer Database/Optimization Letters/44December 2014, Issue 8/paper7.txt",A class of hybrid methods for quasi-variational inequalities,0.02243756437186095,0.0,0.16889395924369574,0.043429144188623106,0.0
"Data_Abstract/Springer Database/Optimization Letters/44December 2014, Issue 8/paper8.txt",Openness results for parametric set-valued mappings in Asplund spaces,0.0016424806753314888,0.04720729752750604,0.00476568951168844,0.13197219490878337,0.000787887348254958
"Data_Abstract/Springer Database/Optimization Letters/44December 2014, Issue 8/paper9.txt",Computational complexity analysis of the sensor location flow observability problem,0.05950427305579089,0.012969977309062696,0.004971951703788682,0.011011334229875797,0.02796514068196598
"Data_Abstract/Springer Database/Optimization Letters/45January 2015, Issue 1/paper1.txt",Robust SOS-convex polynomial optimization problems: exact SDP relaxations,0.03347879633173045,0.1459782835270264,0.006856205005144385,0.0,0.0012594714021055384
"Data_Abstract/Springer Database/Optimization Letters/45January 2015, Issue 1/paper10.txt",Generalized vector quasi-equilibrium problems on Hadamard manifolds,0.0,0.003979055655006825,0.0,0.21866467722912455,0.0
"Data_Abstract/Springer Database/Optimization Letters/45January 2015, Issue 1/paper12.txt",Modified interactive chebyshev algorithm (MICA) for non-convex multiobjective programming,0.008364376076506261,0.09149218691769155,0.10718494836765295,0.011198430363115857,0.005463867191351083
"Data_Abstract/Springer Database/Optimization Letters/45January 2015, Issue 1/paper13.txt",On the adaptation of the mutation scale factor in differential evolution,0.027009948278798896,0.0,0.02438353511610117,0.03689079973427003,0.0
"Data_Abstract/Springer Database/Optimization Letters/45January 2015, Issue 1/paper14.txt",Redundant constraints in the standard formulation for the clique partitioning problem,0.11446668116943011,0.03768836063356714,0.0,0.0,0.0
"Data_Abstract/Springer Database/Optimization Letters/45January 2015, Issue 1/paper2.txt",RLT insights into lift-and-project closures,0.058877553645372074,0.049641318445244734,0.022785242537414475,0.02340783285139326,0.0
"Data_Abstract/Springer Database/Optimization Letters/45January 2015, Issue 1/paper3.txt",A branch and cut algorithm for minimum spanning trees under conflict constraints,0.1284326919692608,0.02326282422387374,0.0,0.020276172642636717,0.0
"Data_Abstract/Springer Database/Optimization Letters/45January 2015, Issue 1/paper4.txt",Solving \(\ell _0\)-penalized problems with simple constraints via the Frank–Wolfe reduced dimension method,0.017069332522870635,0.016310744929766845,0.14380221994579448,0.0022497946070514805,0.018965175018989318
"Data_Abstract/Springer Database/Optimization Letters/45January 2015, Issue 1/paper5.txt",Existence of variational quasi-hemivariational inequalities involving a set-valued operatorand a nonlinear term,0.015218064316850003,0.04986700908237836,0.0,0.21277322132478005,0.00027833389002117305
"Data_Abstract/Springer Database/Optimization Letters/45January 2015, Issue 1/paper6.txt",Single machine serial-batching scheduling with independent setup time and deteriorating job processing times,0.0,0.0,0.0020881578237854337,0.0,0.38112891908868796
"Data_Abstract/Springer Database/Optimization Letters/45January 2015, Issue 1/paper7.txt",Best proximity points for generalized proximal weak contractions in partially ordered metric spaces,0.0,0.0,0.0,0.15033024431781472,0.0
"Data_Abstract/Springer Database/Optimization Letters/45January 2015, Issue 1/paper8.txt",Impact of price-adjustments costs on integration of pricing and production planning of multiple-products,0.10036817337790502,0.021571620320714996,0.0,0.0,0.006196079293209925
"Data_Abstract/Springer Database/Optimization Letters/45January 2015, Issue 1/paper9.txt",Multi-item uncapacitated lot sizing problem with inventory bounds,0.0645958416229017,0.0,0.0,0.0010751587219037643,0.045310939428058104
"Data_Abstract/Springer Database/Optimization Letters/46February 2015, Issue 2/paper1.txt",Characterizing the optimality gap and the optimal packings for the bin packing problem,0.1107292866427813,0.009192485129692576,0.0,0.012661189876858015,0.0
"Data_Abstract/Springer Database/Optimization Letters/46February 2015, Issue 2/paper10.txt",An algorithm for clusterwise linear regression based on smoothing techniques,0.05370464122324414,0.04298059516264177,0.1164070991942566,0.0,0.0
"Data_Abstract/Springer Database/Optimization Letters/46February 2015, Issue 2/paper11.txt",Characterizations of efficiency in vector optimization with \(\mathcal {C}(T)\)-valued mappings,0.00488023803177999,0.07074586404776015,0.0,0.11475838992946065,0.0
"Data_Abstract/Springer Database/Optimization Letters/46February 2015, Issue 2/paper12.txt",Scheduling small number of quay cranes with non-interference constraint,0.04119349809798042,8.609693421579973e-05,0.010673950294758504,0.002476244005366455,0.1082534288285484
"Data_Abstract/Springer Database/Optimization Letters/46February 2015, Issue 2/paper2.txt",A smoothing Newton method for symmetric cone complementarity problems,0.0,0.10247175276137385,0.12252639785865035,0.0,0.004133158938815245
"Data_Abstract/Springer Database/Optimization Letters/46February 2015, Issue 2/paper3.txt",Second-order necessary conditions in locally Lipschitz optimization with inequality constraints,0.0,0.1548191326614603,0.0,0.03353132856195609,0.0
"Data_Abstract/Springer Database/Optimization Letters/46February 2015, Issue 2/paper4.txt",On the auxiliary mappings generated by a family of mappings and solutions of variational inequalities problems,0.0,0.0,0.028350140458988635,0.18375819312124905,0.0
"Data_Abstract/Springer Database/Optimization Letters/46February 2015, Issue 2/paper5.txt",A new trust region method for solving least-square transformation of system of equalities and inequalities,0.0,0.0,0.23319275197335457,0.03480192837784286,0.0
"Data_Abstract/Springer Database/Optimization Letters/46February 2015, Issue 2/paper6.txt",On the tractability of satellite range scheduling,0.034225627770447735,0.019738048232076623,0.0,0.01646163017737737,0.13942823120329184
"Data_Abstract/Springer Database/Optimization Letters/46February 2015, Issue 2/paper7.txt",Scalarization of Levitin–Polyak well-posedness in vector optimization using weak efficiency,0.0205959803679294,0.06072576148565969,0.0,0.10292527155595622,0.0
"Data_Abstract/Springer Database/Optimization Letters/46February 2015, Issue 2/paper8.txt",Valid inequalities and lifting procedures for the shortest path problem in digraphs with negative cycles,0.05863272993387182,0.0024393673594020563,0.01905704559291875,0.047898392192652114,0.00348414997015126
"Data_Abstract/Springer Database/Optimization Letters/46February 2015, Issue 2/paper9.txt",Vector topical functions and Farkas type theorems with applications,0.0,0.12279388741405695,0.010636386233202804,0.0583579984735551,0.0024878024724614427
"Data_Abstract/Springer Database/Optimization Letters/47March 2015, Issue 3/paper1.txt",(Non) convergence results for the differential evolution method,0.0,0.10541004854863736,0.11711303127505084,0.0,0.014636488666272535
"Data_Abstract/Springer Database/Optimization Letters/47March 2015, Issue 3/paper10.txt",An improved algorithm for integrated production and distribution scheduling problem with committed delivery dates,0.02725552488354955,0.0,0.0,0.0,0.1543350807127964
"Data_Abstract/Springer Database/Optimization Letters/47March 2015, Issue 3/paper11.txt",Globally convergent algorithms for finding zeros of duplomonotone mappings,0.0,0.06879408898831726,0.09058457442498391,0.05819820621172484,0.0020822854876140565
"Data_Abstract/Springer Database/Optimization Letters/47March 2015, Issue 3/paper12.txt",Potential energy principles in networked systems and their connections to optimization problems on graphs,0.07825427275949463,0.0,0.0,0.0,0.0
"Data_Abstract/Springer Database/Optimization Letters/47March 2015, Issue 3/paper13.txt",tttplots-compare: a perl program to compare time-to-target plots or general runtime distributions of randomized algorithms,0.04851901114957745,0.0,0.03742601814040036,0.003543915911583505,0.06564967609702303
"Data_Abstract/Springer Database/Optimization Letters/47March 2015, Issue 3/paper2.txt",Complexity of the robust weighted independent set problems on interval graphs,0.04735554351963054,0.01668678951511697,0.009102637464350728,0.012545065471262976,0.03215619364713124
"Data_Abstract/Springer Database/Optimization Letters/47March 2015, Issue 3/paper3.txt",Dynamic programming for spanning tree problems: application to the multi-objective case,0.0947949129166154,0.03186804348715164,0.0,0.0,0.0
"Data_Abstract/Springer Database/Optimization Letters/47March 2015, Issue 3/paper4.txt",The hop-constrained minimum cost flow spanning tree problem with nonlinear costs: an ant colony optimization approach,0.13229472837815878,0.0,0.020205675478243826,0.001174369626926245,0.03908185771543074
"Data_Abstract/Springer Database/Optimization Letters/47March 2015, Issue 3/paper5.txt",Upper and lower bounds for the permutation flowshop scheduling problem with minimal time lags,0.023025317427447282,0.008238347886006317,0.0,0.0012206796121738367,0.27317666972559795
"Data_Abstract/Springer Database/Optimization Letters/47March 2015, Issue 3/paper6.txt",The Tikhonov regularization for equilibrium problems and applications to quasi-hemivariational inequalities,0.0,0.0020841931772858477,0.054182728909697435,0.10345036886895902,0.0
"Data_Abstract/Springer Database/Optimization Letters/47March 2015, Issue 3/paper7.txt",A note on the minimal cone for conic linear programming,0.028666157178538806,0.05168427404492849,0.0,0.008880366054095281,0.0
"Data_Abstract/Springer Database/Optimization Letters/47March 2015, Issue 3/paper8.txt",Boundary of subdifferentials and calmness moduli in linear semi-infinite optimization,0.020952982328578965,0.133688041030614,0.0,0.014043621935994326,0.0
"Data_Abstract/Springer Database/Optimization Letters/47March 2015, Issue 3/paper9.txt",Convex reformulation for binary quadratic programming problems via average objective value maximization,0.008393148328326376,0.044186993737300374,0.14948600002713233,0.0,0.0
"Data_Abstract/Springer Database/Optimization Letters/48April 2015, Issue 4/paper1.txt",An integer programming approach for finding the most and the least central cliques,0.09193452099520769,0.008199157339135107,0.0,0.0,0.0
"Data_Abstract/Springer Database/Optimization Letters/48April 2015, Issue 4/paper10.txt",A projection algorithm for set-valued variational inequalities on Hadamard manifolds,0.0,0.0,0.0413363200182225,0.1512500772291739,0.0
"Data_Abstract/Springer Database/Optimization Letters/48April 2015, Issue 4/paper11.txt",A note on dependency between interval linear systems,0.0,0.04380451008754909,0.0,0.017460963532893455,0.002181024340809406
"Data_Abstract/Springer Database/Optimization Letters/48April 2015, Issue 4/paper12.txt","A joint quay crane assignment and scheduling problem: formulation, solution algorithm and computational results",0.08338864654749881,0.01586370253842574,0.025487167345289646,0.0,0.049020991692564464
"Data_Abstract/Springer Database/Optimization Letters/48April 2015, Issue 4/paper2.txt",An optimisation approach to constructing an exchange-traded fund,0.06366306721408384,0.021611938807778664,0.0,0.015152672482517194,0.005350408399147265
"Data_Abstract/Springer Database/Optimization Letters/48April 2015, Issue 4/paper3.txt",For the airplane refueling problem local precedence implies global precedence,0.05155248639850368,0.005742479530823512,0.0,0.0042662050151183965,0.00994065184186632
"Data_Abstract/Springer Database/Optimization Letters/48April 2015, Issue 4/paper4.txt",A new hybrid heuristic for replica placement and request distribution in content distribution networks,0.08915931259580166,0.011876431546846818,0.06902246337830412,0.01045204085437273,0.0
"Data_Abstract/Springer Database/Optimization Letters/48April 2015, Issue 4/paper5.txt",Necessary and sufficient conditions for emptiness of the cones of generalized support vectors,0.006991501371607137,0.08582771570420171,0.0,0.058716585670519066,0.0
"Data_Abstract/Springer Database/Optimization Letters/48April 2015, Issue 4/paper6.txt",Projection onto simplicial cones by a semi-smooth Newton method,0.0029791937296497133,0.054233610814174604,0.09354346321849372,0.042680414801907145,0.005683837658315728
"Data_Abstract/Springer Database/Optimization Letters/48April 2015, Issue 4/paper7.txt",Thick non-crossing paths in a polygonal domain,0.06922377775248176,0.008483125196830397,0.011552813673226522,0.009518134396882197,0.018449546180209556
"Data_Abstract/Springer Database/Optimization Letters/48April 2015, Issue 4/paper8.txt",Characterizations of the approximate solution sets of nonsmooth optimization problems and its applications,0.0025993685897727228,0.10118511469595391,0.0,0.12281166052643089,0.0
"Data_Abstract/Springer Database/Optimization Letters/48April 2015, Issue 4/paper9.txt",Local maximum points of explicitly quasiconvex functions,0.0,0.1868616531212979,0.01636586457729297,0.0,0.0
"Data_Abstract/Springer Database/Optimization Letters/49June 2015, Issue 5/paper1.txt",On solving convex optimization problems with linear ascending constraints,0.008357135288195964,0.09274393541849853,0.17438769851422772,0.0,0.01597921934763523
"Data_Abstract/Springer Database/Optimization Letters/49June 2015, Issue 5/paper10.txt",Restricted strong convexity and its applications to convergence analysis of gradient-type methods in convex optimization,0.0,0.10802164148949518,0.13165815533598474,0.0,0.0
"Data_Abstract/Springer Database/Optimization Letters/49June 2015, Issue 5/paper11.txt",Moderately exponential time algorithms for the maximum induced matching problem,0.06516786102401798,0.0,0.020034182211295253,0.0,0.06130571818026654
"Data_Abstract/Springer Database/Optimization Letters/49June 2015, Issue 5/paper12.txt",A modified Perry conjugate gradient method and its global convergence,0.0,0.004219033364951193,0.2736561804570454,0.0,0.0
"Data_Abstract/Springer Database/Optimization Letters/49June 2015, Issue 5/paper13.txt",Optimality conditions for pseudoconvex minimization over convex sets defined by tangentially convex constraints,0.0,0.2658978366899351,0.0,0.0,0.0
"Data_Abstract/Springer Database/Optimization Letters/49June 2015, Issue 5/paper14.txt",A new approach for bicriteria partitioning problem,0.025428652948298176,0.007855355515093185,0.13719084012784497,0.0,0.007613584810957119
"Data_Abstract/Springer Database/Optimization Letters/49June 2015, Issue 5/paper2.txt",The clique problem for graphs with a few eigenvalues of the same sign,0.048832065229914484,0.05197950378656261,0.0,0.0,0.0
"Data_Abstract/Springer Database/Optimization Letters/49June 2015, Issue 5/paper3.txt",The calculus of simplex gradients,0.01284594709048412,0.027921240366502283,0.05576081179952829,0.0,0.0007284014992635185
"Data_Abstract/Springer Database/Optimization Letters/49June 2015, Issue 5/paper4.txt",Convex risk minimization via proximal splitting methods,0.019631463765096613,0.06453457866732444,0.0759138556592671,0.005680297548371632,0.0
"Data_Abstract/Springer Database/Optimization Letters/49June 2015, Issue 5/paper5.txt",Error bounds for polynomial optimization over the hypercube using putinar type representations,0.02161359975552159,0.046644834689139256,0.0,0.0,0.005340617803234472
